repo,sha,author,date,message,additions,deletions,total_changes
ollama/ollama,e5d84fb90b21d71f8eb816656ca0b34191425216,molbal,2025-03-26T20:39:01Z,docs: add molbal/orca-cli to community integrations (#9909),1,0,1
ollama/ollama,dd66712e3159161c1de9c39a12fb83edf8813d39,Hengky Steen,2025-03-26T20:38:05Z,docs: add ollamb to community projects,1,0,1
ollama/ollama,f66216e3990b73869341c58ac9561b26c468c558,Jesse Gross,2025-03-24T20:39:07Z,"ggml: Support heterogeneous KV cache layer sizes in memory estimation  Gemma3 uses sliding windows for its context on 5/6 layers, significantly reducing memory usage but leading to uneven usage across layers, which makes allocation to the correct GPU difficult. We currently estimate very conservatively by assuming all layers are consistent at the max size.  Llama3.2-vision is also inconsistent between self attention and cross attention layers - at moment, we calculate the correct total size and then average this across layers. In some cases, this may lead to crashes if a large layer is placed on a GPU sized by the average.  This allows memory estimation to calculate per-layer KV cache size and take this account when placing layers onto GPUs. We already do this for weights that vary per-tensor, so this is a logical extension.  Fixes #9730 Fixes #9890",49,28,77
ollama/ollama,f4f0992b6ea5d651eff609461c24ece936bd5708,Jesse Gross,2025-03-25T18:41:26Z,llm: Fix debug logging for memory estimates,1,1,2
ollama/ollama,1feff619779115d76f033eb59a7a896aad6c2e18,Jesse Gross,2025-03-25T04:17:53Z,"kvcache: Sliding window cache only needs a single batch total  When computing the size of the cache for sliding window attention, we don't need to multiple the batch size by the number of parallel sequences - the batch size is constant.  This also simplifies the check for whether to allocate the cache size based on capacity or window size as the batch size is already incorporated into the capacity when handled by the runner.",2,2,4
ollama/ollama,5e0b904e887fc648fb8a3a55283f8f33063a78eb,copeland3300,2025-03-25T16:52:23Z,docs: add flags to example linux log output command (#9852),1,1,2
ollama/ollama,131f0355a59f4840b057fb8f3c2e59e456f91041,Matheus C. França,2025-03-24T16:25:58Z,readme: add ollama-d library (#9907),1,0,1
ollama/ollama,ce929984a33230269905e0e3cfa335cb8d6ba781,Blake Mizerany,2025-03-21T23:16:38Z,"server/internal/client/ollama: fix file descriptor management in Pull (#9931)  Close chunked writers as soon as downloads complete, rather than deferring closure until Pull exits. This prevents exhausting file descriptors when pulling many layers.  Instead of unbounded defers, use a WaitGroup and background goroutine to close each chunked writer as soon as its downloads finish.  Also rename 'total' to 'received' for clarity.",31,25,56
ollama/ollama,4b34930a31ceb9cc10d95b8bcd60c319f47d8043,Michael Yang,2025-03-21T21:47:13Z,Merge pull request #9897 from ollama/mxyng/chunk-load  ml/backend/ggml: load tensors in 128KiB chunks,58,30,88
ollama/ollama,74bd09652d69c77a4bed34b3afda74c87295115b,Michael Yang,2025-03-19T20:03:16Z,ml/backend/ggml: load tensors in 32KiB chunks,58,30,88
